"trans","origin"
"江南清明时节细雨纷纷飘洒，路上羁旅行人个个落魄断魂。","清明时节雨纷纷，路上行人欲断魂。"
"借问当地之人何处买酒浇愁，牧童笑而不答遥指杏花山村。","借问酒家何处有，牧童遥指杏花村。"
"北风席卷大地把白草吹折，胡地天气八月就纷扬落雪。","北风卷地白草折，胡天八月即飞雪。"
"忽然间宛如一夜春风吹来，好像是千树万树梨花盛开。","忽如一夜春风来，千树万树梨花开。"
"雪花散入珠帘打湿了罗幕，狐裘穿不暖锦被也嫌单薄。","散入珠帘湿罗幕，狐裘不暖锦衾薄。"
"将军都护手冻得拉不开弓，铁甲冰冷得让人难以穿着。","将军角弓不得控，都护铁衣冷难着。"
"沙漠结冰百丈纵横有裂纹，万里长空凝聚着惨淡愁云。","瀚海阑干百丈冰，愁云惨淡万里凝。"
"主帅帐中摆酒为归客饯行，胡琴琵琶羌笛合奏来助兴。","中军置酒饮归客，胡琴琵琶与羌笛。"
"傍晚辕门前大雪落个不停，红旗冻僵了风也无法牵引。","纷纷暮雪下辕门，风掣红旗冻不翻。"
"轮台东门外欢送你回京去，你去时大雪盖满了天山路。","轮台东门送君去，去时雪满天山路。"
"山路迂回曲折已看不见你，雪上只留下一行马蹄印迹。 ","山回路转不见君，雪上空留马行处。"
"春天的江潮水势浩荡，与大海连成一片，一轮明月从海上升起，好像与潮水一起涌出来。","春江潮水连海平，海上明月共潮生。"
"月光照耀着春江，随着波浪闪耀千万里，所有地方的春江都有明亮的月光。","滟滟随波千万里，何处春江无月明!"
"江水曲曲折折地绕着花草丛生的原野流淌，月光照射着开遍鲜花的树林好像细密的雪珠在闪烁。","江流宛转绕芳甸，月照花林皆似霰;"
"月色如霜，所以霜飞无从觉察。洲上的白沙和月色融合在一起，看不分明。","空里流霜不觉飞，汀上白沙看不见。"
"江水、天空成一色，没有一点微小灰尘，明亮的天空中只有一轮孤月高悬空中。","江天一色无纤尘，皎皎空中孤月轮。"
"江边上什么人最初看见月亮，江上的月亮哪一年最初照耀着人？","江畔何人初见月？江月何年初照人？"
"人生一代代地无穷无尽，只有江上的月亮一年年地总是相像。","人生代代无穷已，江月年年望相似。"
"不知江上的月亮等待着什么人，只见长江不断地一直运输着流水。","不知江月待何人，但见长江送流水。"
"游子像一片白云缓缓地离去，只剩下思妇站在离别的青枫浦不胜忧愁。","白云一片去悠悠，青枫浦上不胜愁。"
"哪家的游子今晚坐着小船在漂流？什么地方有人在明月照耀的楼上相思？","谁家今夜扁舟子？何处相思明月楼？"
"可怜楼上不停移动的月光，应该照耀着离人的梳妆台。","可怜楼上月徘徊，应照离人妆镜台。"
"月光照进思妇的门帘，卷不走，照在她的捣衣砧上，拂不掉。","玉户帘中卷不去，捣衣砧上拂还来。"
"这时互相望着月亮可是互相听不到声音，我希望随着月光流去照耀着您。","此时相望不相闻，愿逐月华流照君。"
"鸿雁不停地飞翔，而不能飞出无边的月光；月照江面，鱼龙在水中跳跃，激起阵阵波纹。","鸿雁长飞光不度，鱼龙潜跃水成文。"
"昨天夜里梦见花落闲潭，可惜的是春天过了一半自己还不能回家。","昨夜闲潭梦落花，可怜春半不还家。"
"江水带着春光将要流尽，水潭上的月亮又要西落。","江水流春去欲尽，江潭落月复西斜。"
"斜月慢慢下沉，藏在海雾里，碣石与潇湘的离人距离无限遥远。","斜月沉沉藏海雾，碣石潇湘无限路。"
"不知有几人能趁着月光回家，唯有那西落的月亮摇荡着离情，洒满了江边的树林。 ","不知乘月几人归，落月摇情满江树。"
"迷蒙的烟雨，连夜洒遍吴地江天；清晨送走你，孤对楚山离愁无限！","寒雨连江夜入吴，平明送客楚山孤。"
"朋友啊，洛阳亲友若是问起我来；就说我依然冰心玉壶，坚守信念！","洛阳亲友如相问，一片冰心在玉壶。"
"高高的柳树长满了翠绿的新叶，轻柔的柳枝垂下来，就像万条轻轻飘动的绿色丝带。","碧玉妆成一树高，万条垂下绿丝绦。"
"这细细的嫩叶是谁的巧手裁剪出来的呢？原来是那二月里温暖的春风，它就像一把灵巧的剪刀。","不知细叶谁裁出，二月春风似剪刀。"
"绕过孤山寺以北漫步贾公亭以西，湖水初涨与岸平齐白云垂得很低。","孤山寺北贾亭西，水面初平云脚低。"
"几只早出的黄莺争栖向阳的暖树，谁家新飞来的燕子忙着筑巢衔泥。","几处早莺争暖树，谁家新燕啄春泥。"
"野花竞相开放就要让人眼花缭乱，春草还没有长高才刚刚没过马蹄。","乱花渐欲迷人眼，浅草才能没马蹄。"
"最喜爱湖东的美景令人流连忘返，杨柳成排绿荫中穿过一条白沙堤。","最爱湖东行不足，绿杨阴里白沙堤。"
"透过装饰着云母的屏风，烛影渐渐暗淡下去。银河也在静静地消失，晨星沉没在黎明的曙光里。","云母屏风烛影深，长河渐落晓星沉。"
"月宫的嫦娥恐怕后悔偷了后羿的长生不老药，现在只有那青天碧海夜夜陪伴着她一颗孤独的心。","嫦娥应悔偷灵药，碧海青天夜夜心。"
"老朋友向我频频挥手，告别了黄鹤楼，在这柳絮如烟、繁花似锦的阳春三月去扬州远游。","故人西辞黄鹤楼，烟花三月下扬州。"
"友人的孤船帆影渐渐地远去，消失在碧空的尽头，只看见一线长江，向邈远的天际奔流。","孤帆远影碧空尽，唯见长江天际流。"
"自古以来每逢秋天都会感到悲凉寂寥，我却认为秋天要胜过春天。","自古逢秋悲寂寥，我言秋日胜春朝。"
"万里晴空，一只鹤凌云而飞起，就引发我的诗兴到了蓝天上了。 ","晴空一鹤排云上，便引诗情到碧霄。"
"见面的机会真是难得，分别时更是难舍难分，况且又兼东风将收的暮春天气，百花残谢，更加使人伤感。","相见时难别亦难，东风无力百花残。"
"春蚕结茧到死时丝才吐完，蜡烛要燃尽成灰时像泪一样的蜡油才能滴干。","春蚕到死丝方尽，蜡炬成灰泪始干。"
"女子早晨妆扮照镜，只担忧丰盛如云的鬓发改变颜色，青春的容颜消失。男子晚上长吟不寐，必然感到冷月侵人。","晓镜但愁云鬓改，夜吟应觉月光寒。"
"对方的住处就在不远的蓬莱山，却无路可通，可望而不可及。希望有青鸟一样的使者殷勤地为我去探看情人。","蓬山此去无多路，青鸟殷勤为探看。"
"两只黄鹂在翠绿的柳树间婉转地歌唱，一队整齐的白鹭直冲向蔚蓝的天空。","两个黄鹂鸣翠柳，一行白鹭上青天。"
"我坐在窗前，可以望见西岭上堆积着终年不化的积雪，门前停泊着自万里外的东吴远行而来的船只。","窗含西岭千秋雪，门泊东吴万里船。"
"金杯里装的名酒，每斗要价十千； 玉盘中盛的精美菜肴，收费万钱。","金樽清酒斗十千，玉盘珍羞直万钱。"
"胸中郁闷啊，我停杯投箸吃不下； 拔剑环顾四周，我心里委实茫然。","停杯投箸不能食，拔剑四顾心茫然。"
"想渡黄河，冰雪堵塞了这条大川； 要登太行，莽莽的风雪早已封山。","欲渡黄河冰塞川，将登太行雪满山。"
"象吕尚垂钓溪，闲待东山再起； 又象伊尹做梦，他乘船经过日边。","闲来垂钓碧溪上，忽复乘舟梦日边。"
"世上行路呵多么艰难，多么艰难； 眼前歧路这么多，我该向北向南？","行路难！行路难！多歧路，今安在？"
"相信总有一天，能乘长风破万里浪； 高高挂起云帆，在沧海中勇往直前！","长风破浪会有时，直挂云帆济沧海。"
"在秋夜里烛光映照着画屏，手拿着小罗扇扑打萤火虫。","银烛秋光冷画屏，轻罗小扇扑流萤。"
"夜色里的石阶清凉如冷水，静坐寝宫凝视牛郎织女星。","天阶夜色凉如水，卧看牵牛织女星。"
"香炉峰在阳光的照射下生起紫色烟霞，远远望见瀑布似白色绢绸悬挂在山前。","日照香炉生紫烟，遥看瀑布挂前川。"
"高崖上飞腾直落的瀑布好像有几千尺，让人恍惚以为银河从天上泻落到人间。","飞流直下三千尺，疑是银河落九天。"
"独自远离家乡难免总有一点凄凉，每到重阳佳节倍加思念远方的亲人。","独在异乡为异客，每逢佳节倍思亲。"
"远远想到兄弟们身佩茱萸登上高处，也会因为少我一人而生遗憾之情。","遥知兄弟登高处，遍插茱萸少一人。"
"您问归期，归期实难说准，巴山连夜暴雨，涨满秋池。","君问归期未有期，巴山夜雨涨秋池。"
"何时归去，共剪西窗烛花，当面诉说，巴山夜雨况味。","何当共剪西窗烛，却话巴山夜雨时。"
"剑门关外，喜讯忽传，官军收复冀北一带。高兴之余，泪满衣裳。","剑外忽传收蓟北，初闻涕泪满衣裳。"
"回望妻子儿女，也已一扫愁云，随手卷起诗书，全家欣喜若狂。","却看妻子愁何在，漫卷诗书喜欲狂。"
"老夫想要纵酒高歌，结伴春光同回故乡。","白日放歌须纵酒，青春作伴好还乡。"
"我的心魂早已高飞，就从巴峡穿过巫峡，再到襄阳直奔洛阳。","即从巴峡穿巫峡，便下襄阳向洛阳。"
"酒筵上甘醇的葡萄美酒盛满在精美的夜光杯之中，歌伎们弹奏起急促欢快的琵琶声助兴催饮，想到即将跨马奔赴沙场杀敌报国，战士们个个豪情满怀。","葡萄美酒夜光杯，欲饮琵琶马上催。"
"今日一定要一醉方休，即使醉倒在战场上又何妨？此次出征为国效力，本来就打算马革裹尸，没有准备活着回来。","醉卧沙场君莫笑，古来征战几人回？"
"我正乘上小船，刚要解缆出发，忽听岸上传来，悠扬踏歌之声。","李白乘舟将欲行，忽闻岸上踏歌声。"
"看那桃花潭水，纵然深有千尺，怎能及汪伦送我之情。","桃花潭水深千尺，不及汪伦送我情。"
"夜静更深，月光只照亮了人家房屋的一半，另一半隐藏在黑夜里。北斗星倾斜了，南斗星也倾斜了。","更深月色半人家，北斗阑干南斗斜。"
"今夜才知春天的来临，因为你听那被树叶映绿的窗纱外，唧唧的虫鸣，头一遭儿传到了屋子里来了。","今夜偏知春气暖，虫声新透绿窗纱。"
"新年都已来到，但还看不到芬芳的鲜花，到二月，才惊喜地发现有小草冒出了新芽。","新年都未有芳华，二月初惊见草芽。"
"白雪也嫌春色来得太晚了，所以有意化作花儿在庭院树间穿飞。","白雪却嫌春色晚，故穿庭树作飞花。"
"一年一度的秋风，又吹到了洛阳城中，身居洛阳城内的游子，不知家乡的亲人怎么样了；写封家书问候平安，要说的话太多了，又不知从何说起。","洛阳城里见秋风，欲作家书意万重。"
"信写好了，又担心匆匆中没有把自己想要说的话写完；当捎信人出发时，又拆开信封，再还给他。","复恐匆匆说不尽，行人临发又开封。"
"巴山楚水凄凉之地，二十三年默默谪居。","巴山楚水凄凉地，二十三年弃置身。"
"回来物是人非，我像烂柯之人，只能吹笛赋诗，空自惆怅不已。","怀旧空吟闻笛赋，到乡翻似烂柯人。"
"沉舟侧畔，千帆竞发；病树前头，万木逢春。","沉舟侧畔千帆过，病树前头万木春。"
"今日听你高歌一曲，暂借杯酒振作精神。","今日听君歌一曲，暂凭杯酒长精神。"
"在杨花落完，子规啼鸣的时候，听说你路过五溪。","杨花落尽子规啼，闻道龙标过五溪。"
"我把我忧愁的心思寄托给明月，希望能随着风一直陪着你到夜郎以西。 ","我寄愁心与明月，随风直到夜郎西。"
"昔日的仙人已乘着黄鹤飞去，这地方只留下空荡的黄鹤楼。","昔人已乘黄鹤去，此地空余黄鹤楼。"
"黄鹤一去再也没有返回这里，千万年来只有白云飘飘悠悠。","黄鹤一去不复返，白云千载空悠悠。"
"汉阳晴川阁的碧树历历可辨，更能看清芳草繁茂的鹦鹉洲。","晴川历历汉阳树，芳草萋萋鹦鹉洲。"
"时至黄昏不知何处是我家乡？看江面烟波渺渺更使人烦愁！","日暮乡关何处是？烟波江上使人愁。"
"长江犹如巨斧劈开天门雄峰，碧绿江水东流到此回旋澎湃。","天门中断楚江开，碧水东流至此回。"
"两岸青山对峙美景难分高下，遇见一叶孤舟悠悠来自天边。","两岸青山相对出，孤帆一片日边来。"
"清晨的微雨湿润了渭城地面的灰尘，馆驿青堂瓦舍柳树的枝叶翠嫩一新。","渭城朝雨浥轻尘，客舍青青柳色新。"
"真诚地奉劝我的朋友再干一杯美酒，向西出了阳关就难以遇到故旧亲人。","劝君更尽一杯酒，西出阳关无故人。"
"依旧是秦汉时期的明月和边关，守边御敌鏖战万里征人未回还。","秦时明月汉时关，万里长征人未还。"
"倘若龙城的飞将卫青如今还在，绝不许匈奴南下牧马度过阴山。","但使龙城飞将在，不教胡马度阴山。"
"黄河好像从白云间奔流而来，玉门关孤独地耸峙在高山中。","黄河远上白云间，一片孤城万仞山。"
"将士何须哀怨那柳树不发芽，春风根本吹不到玉门关外。","羌笛何须怨杨柳，春风不度玉门关。"
"辽阔的干里江南春景美如画，莺歌燕舞绿叶映衬鲜艳红花。","千里莺啼绿映红，水村山郭酒旗风。"
"水村山郭酒旗在春风中招展，南朝佛寺有多少笼罩烟雨下？","南朝四百八十寺，多少楼台烟雨中。"
"黄四娘家花儿茂盛把小路遮蔽，万千花朵压弯枝条离地低又低。","黄四娘家花满蹊，千朵万朵压枝低。"
"眷恋芬芳花间彩蝶时时在飞舞，自由自在娇软黄莺恰恰欢声啼。","留连戏蝶时时舞，自在娇莺恰恰啼。"
"迷离月色和轻烟笼罩寒水和白沙，夜晚船泊在秦淮靠近岸上的酒家。","烟笼寒水月笼沙，夜泊秦淮近酒家。"
"锦瑟呀，你为何竟有五十条弦？每弦每节，都令人怀思黄金华年。","锦瑟无端五十弦，一弦一柱思华年。"
"我心如庄子，为蝴蝶晓梦而迷惘；又如望帝化杜鹃，寄托春心哀怨。","庄生晓梦迷蝴蝶，望帝春心托杜鹃。"
"沧海明月高照，鲛人泣泪皆成珠。蓝田红日和暖，可看到良玉生烟。","沧海月明珠有泪，蓝田日暖玉生烟。"
"悲欢离合之情，岂待今日来追忆，只是当年却漫不经心，早已惘然。读者尽管难以明了《锦瑟》诗的思想内容，但那可供神游的诗境，却很容易在脑子里浮现。","此情可待成追忆，只是当时已惘然。"
"风急天高猿猴啼叫显得十分悲哀，水清沙白的河洲上有鸟儿在盘旋。","风急天高猿啸哀，渚清沙白鸟飞回。"
"无边无际的树木萧萧地飘下落叶，望不到头的长江水滚滚奔腾而来。","无边落木萧萧下，不尽长江滚滚来。"
"悲对秋景感慨万里漂泊常年为客，一生当中疾病缠身今日独上高台。","万里悲秋常作客，百年多病独登台。"
"历尽了艰难苦恨白发长满了双鬓，衰颓满心偏又暂停了浇愁的酒杯。","艰难苦恨繁霜鬓，潦倒新停浊酒杯。"
"我在年少时离开家乡，到了迟暮之年才回来。我的乡音虽未改变，但鬓角的毛发却已经疏落。","少小离家老大回，乡音无改鬓毛衰。"
"儿童们看见我，没有一个认识的。他们笑着询问：这客人是从哪里来的呀？","儿童相见不相识，笑问客从何处来。"
"敌兵滚滚而来，犹如黑云翻卷，想要摧倒城墙；我军严待以来，阳光照耀铠甲，一片金光闪烁。","黑云压城城欲摧，甲光向日金鳞开。"
"秋色里，响亮军号震天动地；黑夜间战士鲜血凝成暗紫。","角声满天秋色里，塞上燕脂凝夜紫。"
"红旗半卷，援军赶赴易水；夜寒霜重，鼓声郁闷低沉。","半卷红旗临易水，霜重鼓寒声不起。"
"只为报答君王恩遇，手携宝剑，视死如归。","报君黄金台上意，提携玉龙为君死！"
"一条弯弯曲曲的小路蜿蜒伸向山顶，在白云飘浮的地方有几户人家。","远上寒山石径斜，白云深处有人家。"
"停下来欣赏这枫林的景色，那火红的枫叶比江南二月的花还要红。","停车坐爱枫林晚，霜叶红于二月花。"
"最是喜爱涧边生长的幽幽野草，还有那树丛深处婉转啼唱的黄鹂。","独怜幽草涧边生，上有黄鹂深树鸣。"
"春潮不断上涨，还夹带着密密细雨。荒野渡口无人，只有一只小船悠闲地横在水面。","春潮带雨晚来急，野渡无人舟自横。"
"京城大道上空丝雨纷纷，它像酥油般细密而滋润，远望草色依稀连成一片，近看时却显得稀疏零星。","天街小雨润如酥，草色遥看近却无。"
"这是一年中最美的季节，远胜过绿柳满城的春末。","最是一年春好处，绝胜烟柳满皇都。"
"一支折断了的铁戟（古代兵器）沉没在水底的沙中还没有销蚀掉，经过自己又磨又洗发现这是当年赤壁之战的遗留之物。","折戟沉沙铁未销，自将磨洗认前朝。"
"假如东风不给周瑜以方便，结局恐怕是曹操取胜，二乔被关进铜雀台了。","东风不与周郎便，铜雀春深锁二乔。"
"是谁家精美的笛子暗暗地发出悠扬的笛声。随着春风飘扬，传遍洛阳全城。","谁家玉笛暗飞声，散入春风满洛城。"
"就在今夜的曲中，听到故乡的《折杨柳》，哪个人的思乡之情不会因此而油然而生呢？ ","此夜曲中闻折柳，何人不起故园情。"
"月亮已落下乌鸦啼叫寒气满天， 对着江边枫树和渔火忧愁而眠。","月落乌啼霜满天，江枫渔火对愁眠。"
"姑苏城外那寂寞清静寒山古寺， 半夜里敲钟的声音传到了客船。","姑苏城外寒山寺，夜半钟声到客船。"
"秋夜明月清辉，遍洒澄净湖面，湖面平静无风，犹如铁磨铜镜。","湖光秋月两相和，潭面无风镜未磨。"
"遥望美丽洞庭的湖光山色。真的令人浮想联翩。那翠绿的君山，真像银盘里的一枚玲珑青螺。","遥望洞庭山水色，白银盘里一青螺。"
"清晨，朝霞满天，我就要踏上归程。从江上往高处看，可以看见白帝城彩云缭绕，如在云间，景色绚丽！千里之遥的江陵，一天之间就已经到达。","朝辞白帝彩云间，千里江陵一日还。"
"两岸猿猴的啼声不断，回荡不绝。猿猴的啼声还回荡在耳边时，轻快的小船已驶过连绵不绝的万重山峦。","两岸猿声啼不住，轻舟已过万重山。"
"高峻的峨眉山前，悬挂着半轮秋月。流动的平羌江上，倒映着精亮月影。","峨眉山月半轮秋，影入平羌江水流。"
"夜间乘船出发，离开清溪直奔三峡。想你却难相见，恋恋不舍去向渝州。","夜发清溪向三峡，思君不见下渝州。"
"东望家乡路程又远又长，热泪湿双袖还不断流淌。","故园东望路漫漫，双袖龙钟泪不干。"
"在马上与你相遇无纸笔，请告家人说我平安无恙。","马上相逢无纸笔，凭君传语报平安。"
"暮春时节，长安城处处柳絮飞舞、落红无数，寒食节东风吹拂着皇家花园的柳枝。","春城无处不飞花，寒食东风御柳斜。"
"夜色降临，宫里忙着传蜡烛，袅袅炊烟散入王侯贵戚的家里。","日暮汉宫传蜡烛，轻烟散入五侯家。"
"身经沙场百战铁甲已破碎，城池南面被敌人重重包围。","百战沙场碎铁衣，城南已合数重围。"
"突进营垒，射杀呼延大将，独自率领残兵千骑而归。","突营射杀呼延将，独领残兵千骑归。"
"何处去寻找武侯诸葛亮的祠堂？在成都城外那柏树茂密的地方。","丞相祠堂何处寻，锦官城外柏森森。"
"碧草照映台阶自当显露春色，树上的黄鹂隔枝空对婉转鸣唱。","映阶碧草自春色，隔叶黄鹂空好音。"
"定夺天下先主曾三顾茅庐拜访，辅佐两朝开国与继业忠诚满腔。","三顾频烦天下计，两朝开济老臣心。"
"可惜出师伐魏未捷而病亡军中，常使历代英雄们对此涕泪满裳！","出师未捷身先死，长使英雄泪满襟。"
"刚开始听到远行去南方的大雁的鸣叫声，蝉鸣就已经销声匿迹了，我登上百尺高楼，极目远眺，水天连成一片。","初闻征雁已无蝉，百尺楼高水接天。"
"霜神青女和月中嫦娥不怕寒冷，在寒月冷霜中争艳斗俏，比一比冰清玉洁的美好姿容。","青女素娥俱耐冷，月中霜里斗婵娟。"
"一道残阳渐沉江中，半江碧绿半江艳红。","一道残阳铺水中，半江瑟瑟半江红。"
"最可爱的是那九月初三之夜，亮似珍珠郎朗新月形如弯弓。","可怜九月初三夜，露似真珠月似弓。"
"青海湖上乌云密布，连绵雪山一片黯淡。边塞古城，玉门雄关，远隔千里，遥遥相望。","青海长云暗雪山，孤城遥望玉门关。"
"守边将士，身经百战，铠甲磨穿，壮志不灭，不打败进犯之敌，誓不返回家乡。","黄沙百战穿金甲，不破楼兰终不还。"
"当年在岐王宅里，常常见到你的演出；在崔九堂前，也曾多次欣赏你的艺术。","岐王宅里寻常见，崔九堂前几度闻。"
"没有想到，在这风景一派大好的江南；正是落花时节，能巧遇你这位老相熟。","正是江南好风景，落花时节又逢君。"
"一丛一丛的秋菊环绕着房屋，看起来好似诗人陶渊明的家。绕着篱笆观赏菊花，不知不觉太阳已经快落山了。","秋丛绕舍似陶家，遍绕篱边日渐斜。"
"不是因为百花中偏爱菊花，只是因为菊花开过之后便不能够看到更好的花了。","不是花中偏爱菊，此花开尽更无花。"
"兰陵美酒甘醇，就像郁金香芬芳四溢。兴来盛满玉碗，泛出琥珀光晶莹迷人。","兰陵美酒郁金香，玉碗盛来琥珀光。"
"主人端出如此好酒，定能醉倒他乡之客。最后哪能分清，何处才是家乡？","但使主人能醉客，不知何处是他乡。"
"黄师塔前的江水向东流去，温暖的春天使人懒洋洋地发困，我倚着和煦的春风缓步前行。","黄师塔前江水东，春光懒困倚微风。"
"一丛丛盛开的桃花好像没人经管，你喜欢深红色，还是浅红色的桃花？","桃花一簇开无主，可爱深红爱浅红？"
"每天三更半夜到鸡啼叫的时候，是男孩子们读书的最好时间。","三更灯火五更鸡，正是男儿读书时。"
"少年时只知道玩，不知道要好好学习，到老的时候才后悔自己年少时为什么不知道要勤奋学习。","黑发不知勤学早，白首方悔读书迟。"
"在人间四月里百花凋零已尽，高山古寺中的桃花才刚刚盛开。","人间四月芳菲尽，山寺桃花始盛开。"
"我常为春光逝去无处寻觅而怅恨，却不知它已经转到这里来。","长恨春归无觅处，不知转入此中来。"
"桂花从天而降，好像是月上掉下来似的。拾起殿前的桂花，只见其颜色洁白、新鲜。","玉颗珊珊下月轮，殿前拾得露华新。"
"我到现在也不明白吴刚为什么要跟桂花树过不去。这桂花大概是嫦娥撒下来给予众人的吧。","至今不会天中事，应是嫦娥掷与人。"
"绿树葱郁浓阴夏日漫长，楼台的倒影映入了池塘。","绿树阴浓夏日长，楼台倒影入池塘。"
"水精帘在抖动微风拂起，满架蔷薇惹得一院芳香。","水晶帘动微风起，满架蔷薇一院香。"
"朱雀桥边一些野草开花，乌衣巷口唯有夕阳斜挂。","朱雀桥边野草花，乌衣巷口夕阳斜。"
"当年王导、谢安檐下的燕子，如今已飞进寻常百姓家中。","旧时王谢堂前燕，飞入寻常百姓家。"
"一个蓬头发蓬乱、面孔青嫩的小孩在河边学钓鱼，侧着身子坐在草丛中，野草掩映了他的身影。","蓬头稚子学垂纶，侧坐莓苔草映身。"
"听到有过路的人问路，小孩漠不关心地摆了摆手，生怕惊动了鱼儿，不敢回应过路人。","路人借问遥招手，怕得鱼惊不应人。"
"我独自在旅馆里躺着，寒冷的灯光照着我，久久难以入眠。是什么事情，让我这个游客的心里变得凄凉悲伤？","旅馆寒灯独不眠，客心何事转凄然。"
"故乡的人今夜一定在思念远在千里之外的我；我的鬓发已经变得斑白，到了明天又是新的一年。","故乡今夜思千里，霜鬓明朝又一年。"
"去年春天，就在这扇门里，姑娘脸庞，相映鲜艳桃花。","去年今日此门中，人面桃花相映红。"
"今日再来此地，姑娘不知去向何处，只有桃花依旧，含笑怒放春风之中。","人面不知何处去，桃花依旧笑春风。"
"曾经到临过沧海，别处的水就不足为顾；若除了巫山，别处的云便不称其为云。","曾经沧海难为水，除却巫山不是云。"
