"trans","origin"
"抱着琴瑟看月亮，许多树隐蔽着昭阳宫。","斜抱云和深见月，朦胧树色隐昭阳。"
"从南山截段竹筒做成觱篥，这种乐器本来是出自龟兹。","南山截竹为觱篥，此乐本自龟兹出。"
"流传到汉地曲调变得新奇，凉州胡人安万善为我奏吹。","流传汉地曲转奇，凉州胡人为我吹。"
"座旁的听者个个感慨叹息，思乡的游客人人悲伤落泪。","傍邻闻者多叹息，远客思乡皆泪垂。"
"世人只晓听曲不懂得欣赏，乐人就像独行于暴风之中。","世人解听不解赏，长飙风中自来往。"
"又像风吹枯桑老柏沙沙响，还像九只雏凤鸣叫啾啾啼。","枯桑老柏寒飕飗，九雏鸣凤乱啾啾。"
"好似龙吟虎啸同时都爆发，又如万籁齐响秋天百泉汇。","龙吟虎啸一时发，万籁百泉相与秋。"
"忽然变作渔阳掺低沉悲壮，顿使白日转昏暗乌云翻飞。","忽然更作渔阳掺，黄云萧条白日暗。"
"再变如同杨柳枝热闹欢快，仿佛看到上林苑繁花似锦。 ","变调如闻杨柳春，上林繁花照眼新。"
"除夕夜高堂上明烛放光芒，喝杯美酒再欣赏一曲觱篥。","岁夜高堂列明烛，美酒一杯声一曲。"
"高高的宫门和楼阁冰浴在夕阳的余晖中，桃李技叶茂密，柳絮随风飞舞。","洞门高阁霭馀辉，桃李阴阴柳絮飞。"
"皇宫里钟声稀疏，官舍中办公的官吏已经很少，门下省里只听见乌鸣。","禁里疏钟官舍晚，省中啼鸟吏人稀。"
"早晨步入金殿时玉佩摇晃，夜晚捧着皇帝的沼书拜别宫门。","晨摇玉佩趋金殿，夕奉天书拜琐闱。"
"想勉强跟着您一同进退，无奈我已衰老，会因病卧床而解下我这身官袍。","强欲从君无那老，将因卧病解朝衣。"
"雪花打在竹丛和树枝上，不时发出沙沙响声；浓密的雪片从空中飘落下来，聚集在地面上。","竹树无声或有声，霏霏漠漠散还凝。"
"岭头的梅花已经凋谢，现在又好像重新开放了；山岩积雪融化后的流水，却又结成寒冰。","岭梅谢后重妆蕊，岩水铺来却结冰。"
"要把驯养的小鹿栓牢，严防它们乱跑而被雪天打猎的人捉去；将煮茶的壶水添满，等候山寺的僧人共同品尝、吟诗。","牢系鹿儿防猎客，满添茶鼎候吟僧。"
"可以将春雪同春雨的功劳相比；春雪过后，松间小路上的莓苔，将会更加浓密。","好将膏雨同功力，松径莓苔又一层。"
"在遥远的故乡，曾听过子规鸟凄恻的鸣啼；如今在异乡宣城，又看到盛开的杜鹃花。","蜀国曾闻子规鸟，宣城又见杜鹃花。"
"子规鸣叫悲啭，使人愁肠寸断。暮春三月，这鸟鸣花开的时节，游子正思念他的故乡三巴。","一叫一回肠一断，三春三月忆三巴。"
"潇洒不羁飘荡江湖十多个春秋，没有一天不在酒杯前徘徊逗留。","潇洒江湖十过秋，酒杯无日不迟留。"
"谢公城边被溪水声响惊醒酣梦，苏小门前的柳枝常常拂过我头。","谢公城畔溪惊梦，苏小门前柳拂头。"
"天下的山川景物到底哪里最好，几人怀抱这般情韵一生就罢休？","千里云山何处好，几人襟韵一生休。"
"尘世中人挂冠归去原是平常事，终于将蹉跎了的光阴来寻访旧游。","尘冠挂却知闲事，终拟蹉跎访旧游。"
"听厌了杜鹃朝朝暮暮的啼叫，不料忽然间传来了黄鹂的鸣唱。","倦闻子规朝暮声，不意忽有黄鹂鸣。"
"熟悉的叫声打断了我在湘江边上的睡梦，满眼显现出故乡生机盎然的景象。","一声梦断楚江曲，满眼故园春意生。"
"那里放眼千里看不到高山大河，与长天相连翻滚着青青麦浪。","目极千里无山河，麦芒际天摇清波。"
"京都地区优待农民少征赋役，乡邻们在农忙过后、酒酿成熟频繁来往。","王畿优本少赋役，务闲酒熟饶经过。"
"在那炊烟袅袅巷道深深的村舍里，村南巷北的人们远远地打着招呼互话短长。","此时晴烟最深处，舍南巷北遥相语。"
"黄鹂翻飞在阳光下高高地横过昆明池，又迎着风斜看着细柳展翅飞翔。","翻日迥度昆明飞，凌风邪看细柳翥。"
"我如今跌落在家乡的千山万水之外，就像楚地客家人那样不再返家回乡。","我今误落千万山，身同伧人不思还。"
"你这故乡的鸟儿为什么要来到这里，使我心里不禁思念起遥远的家乡。","乡禽何事亦来此，令我生心忆桑梓。"
"停止鸣叫调转翅膀快快往回飞吧，你爱吃的西林紫桑就要飘出成熟的果香。","闭声回翅归务速，西林紫椹行当熟。"
"头戴红巾的卫士不住报说寒夜欲晓，尚衣官员给天子呈上了翠绿的云裘。","绛帻鸡人送晓筹，尚衣方进翠云裘。"
"早朝的百官曙色中走进辉煌的宫殿，同万国使节向加冕悬旒的皇帝叩头。","九天阊阖开宫殿，万国衣冠拜冕旒。"
"初出的日光晃动着君王的雉尾掌扇，浮动的香烟飘向了皇上的衮龙袍绣。","日色才临仙掌动，香烟欲傍衮龙浮。"
"罢朝后把天子的圣旨写在五色纸上，紫服玉佩的中书文官此刻纷忙不休。","朝罢须裁五色诏，佩声归向凤池头。"
"我军驻扎在武功县东门外的青坂，天气严寒，兵士都在太白山的泉窟中饮马。","我军青坂在东门，天寒饮马太白窟。"
"黄头的奚兵每天向西推进，只有几个骑兵，居然敢弯弓射箭向我军冲击。","黄头奚儿日向西，数骑弯弓敢驰突。"
"这时，山上是雪，河中有冰，旷野里一片萧瑟气象。青的是报警的烽烟，白的是战死兵士的枯骨。","山雪河冰野萧瑟，青是烽烟白人骨。"
"怎么能托人带个信给我军，嘱咐他们暂时忍耐一下，等到明年再来反攻，千万不要急躁。","焉得附书与我军，忍待明年莫仓卒。"
"大风夹杂着霜雪猛烈地肆虐在天地之间，温泉火井（火井可能是炭炉）旁边也了无生气。","浩汗霜风刮天地，温泉火井无生意。"
"河海中的龙蛇也冻得不得伸展（或者是，河海像龙蛇一样冻得不得伸展），连四季常青的松柏都退去了绿色，显得消瘦了许多。","泽国龙蛇冻不伸，南山瘦柏消残翠。"
"去年我们相别，有人传话说您游江东去了。","去年别我向何处，有人传道游江东。"
"又说您挂帆东海，直渡沧溟，一路上平安无事，风平浪静。","谓言挂席度沧海，却来应是无长风。"
"和煦的太阳照耀着大地，积雪大半已消融，解冻的路面布满泥泞，经冬的野草茁出了新芽，原野上一片青葱，马声洪亮，催促主人上路。","日暖泥融雪半消，行人芳草马声骄。"
"云雾缭绕的九华山路旁，寺宇时隐时现，青弋江村边，春风杨柳，轻拂桥面。","九华山路云遮寺，清弋江村柳拂桥。"
"你的志向像鸿雁一样鲜明，踌躇满志，而我的心情却像悬挂在空中的旗帜般空虚。","君意如鸿高的的，我心悬旆正摇摇。"
"我们原来是一起从京城到宣州任职的，此时却不能一同回去了，在这风光明媚的春日里，我只身回到京城以后，将会感到非常寂寞的。","同来不得同归去，故国逢春一寂寥！"
"惜别伤春连日来酒醉昏昏，醒来之后衣裳上全是酒痕。","惜春连日醉昏昏，醒后衣裳见酒痕。"
"细水上漂着落花流入另涧，阴云带雨飘入那远处孤村。","细水浮花归别涧，断云含雨入孤村。"
"闲居无聊恨芳时白白流去，异地千里难招来古人精魂。","人闲易有芳时恨，地迥难招自古魂。"
"最感激流莺掀转深情厚意，每当清晨还特意飞到西园。","惭愧流莺相厚意，清晨犹为到西园。"
"细腰宫里桃花绽放一派艳丽清新，心念故国默默无语度过多少冬春。","细腰宫里露桃新，脉脉无言度几春。"
"说到底息国灭亡究竟是因为何事？可怜金谷园殉情的绿珠这坠楼人！","至竟息亡缘底事，可怜金谷坠楼人。"
"荷花的清香飘满辽阔的湖陂，年轻的姑娘贪玩爱耍把采莲延迟。","菡萏香连十顷陂，小姑贪戏采莲迟。"
"傍晚她戏弄湖水把船头淋湿，更脱下红裙网罗池中鸭儿。","晚来弄水船头湿，更脱红裙裹鸭儿。"
"小船掀动了满湖风光，水波相连一派清秋，痴情贪看年轻人，让小船任意飘流。","船动湖光滟滟秋，贪看年少信船流。"
"竟然无缘无故隔船抛丢莲子，可是被远处的人看见，她大半天还在害羞。","无端隔水抛莲子，遥被人知半日羞。"
"池塘上没有什么风，只有那落日的余辉，杨花在天晴后又各自从池塘上飞起来了。","池上无风有落晖，杨花晴后自飞飞。"
"柳絮为了依靠它的纤质越过这清镜似的池塘，却满身湿透而不能够归去了。","为将纤质凌清镜，湿却无穷不得归。"
"鸟儿歌颂着花的到来，轻烟萦绕在柳边，别去了这地的风景，不禁想起了年少的往前。","鸟啼花发柳含烟，掷却风光忆少年。"
"还要上那高楼眺望着江水绵绵，故乡里哪个地方会迎来一只归船？","更上高楼望江水，故乡何处一归船。"
"冬至之后，白天渐长而黑夜渐短。我在远远的成都思念洛阳。","冬至至后日初长，远在剑南思洛阳。"
"我在严武的幕府中志不自展，成都虽也有如金谷、铜驼一类的胜地但毕竟不是故乡金谷铜驼。","青袍白马有何意，金谷铜驼非故乡。"
"梅花正含苞欲放，我不自觉地想起我洛阳的兄弟朋友。","梅花欲开不自觉，棣萼一别永相望。"
"愁闷极了，本想写诗来排愁，没想到越写越凄凉了。","愁极本凭诗遣兴，诗成吟咏转凄凉。"
"小奴绑缚了鸡子预备上市出售，鸡儿被缚急了正喧叫挣扎不停。","小奴缚鸡向市卖，鸡被缚急相喧争。"
"家里人最讨厌鸡儿食虫又啄粟，未想到鸡儿卖出难逃宰烹厄运。","家中厌鸡食虫蚁，不知鸡卖还遭烹。"
"昆虫鸡子与人有什么厚薄可言，我责备那小奴快解绳放鸡一命。","虫鸡于人何厚薄，我斥奴人解其缚。"
"啊，鸡与虫的得失无终无了啊，我倚楼阁注目寒江而思潮难平。","鸡虫得失无了时，注目寒江倚山阁。"
"小小少年，小小和尚，名号怀素。你的草书堪称风格迥异，独步天下。","少年上人号怀素，草书天下称独步。"
"你用掉的墨水之多，简直就可以养北冰洋的鲸鱼。你用了那么多兔毫笔，难怪中山的兔子都被杀光了。","墨池飞出北溟鱼，笔锋杀尽中山兔。"
"八九月这里天气正凉爽。酒徒诗人，高堂满座。","八月九月天气凉，酒徒词客满高堂。"
"地上放着几箱白布和纸笺，都是别人请你书写的。桌子上摆放着宣州的石砚，放射着墨水的黑又亮的光芒。","笺麻素绢排数箱，宣州石砚墨色光。"
"我的小师傅喝醉以后就在绳床上小眯一会 。突然起身，须臾之间就横扫了几千张字。","吾师醉后倚绳床，须臾扫尽数千张。"
"如同疾风骤雨一样，飒飒惊魂。又像花飞雪飘飘扬扬，一片苍茫。","飘风骤雨惊飒飒，落花飞雪何茫茫！"
"有时候对着粉白的墙壁手不停笔，字大如斗。","起来向壁不停手，一行数字大如斗。"
"观看你书写的人一个个惶惶然如见鬼神。满眼只见龙飞凤舞巨蟒游走。","怳怳如闻神鬼惊，时时只见龙蛇走。"
"笔势左盘右收，左冲右突，如同漫天的闪电。也如同汉楚之间的战争来回拉锯。","左盘右蹙如惊电，状同楚汉相攻战。"
"湖南七郡多少名门大家。那家的屏风和粉壁没有珍藏你的笔墨？","湖南七郡凡几家，家家屏障书题遍。"
"什么王羲之什么张伯英，那也叫草圣？跟你一比就知道他们是浪得了几百年的虚名。","王逸少，张伯英，古来几许浪得名。"
"我那位癫狂的酒友张旭，也号称草圣，他现在可是廉颇老矣，饭都吃不了了，现在凑不上草圣的名号了。我的小师傅的笔法不拘于古人的规矩。","张颠老死不足数，我师此义不师古。"
"潮落后江面平静还没有起风，乘一只小船渡江与您相从。","潮落江平未有风，扁舟共济与君同。"
"不时探头向天边眺望，您可知哪座青山是我要去的越中？","时时引领望天末，何处青山是越中。"
"居延城外胡人正在狩猎，白草连天大火漫天燃烧。","居延城外猎天骄，白草连天野火烧。"
"暮云下旷远的沙漠纵马飞驰，秋日里辽阔的平原正好射雕。","暮云空碛时驱马，秋日平原好射雕。"
"护羌校慰坚守阵地登上障堡，破虏将军勇猛出击夜渡辽河。","护羌校尉朝乘障，破虏将军夜渡辽。"
"那镶玉的剑，角饰的弓，战马戴着珠络头，朝廷要赐给得胜的将军：勇如汉朝的霍嫖姚。","玉靶角弓珠勒马，汉家将赐霍嫖姚。"
"将谓岭头闲得了，夕阳犹挂数枝云。","大夫名价古今闻，盘屈孤贞更出群。"
"十年来身世漂泊若浮萍，白发相逢涕泪沾满冠缨。","十年身事各如萍，白首相逢泪满缨。"
"人老了不知道花有美态，离乱时只觉得酒甚多情。","老去不知花有态，乱来唯觉酒多情。"
"贫居陋巷怀疑春天也少，贵居豪宅感觉月亮最明。","贫疑陋巷春偏少，贵想豪家月最明。"
"姑且对着这尊美酒大笑，未衰之年应见海内清平。","且对一尊开口笑，未衰应见泰阶平。"
"心志在天边,身子却困在架子上，想要腾飞却没有机会和条件。","天边心胆架头身，欲拟飞腾未有因。"
"最终总会翱翔在万里碧空之中，只是不知道谁是解开绳子的人。","万里碧霄终一去，不知谁是解绦人。"
"回头望高高城楼，银河已经渐渐暗淡向西下落，长亭的窗下，渠水荡漾着层层轻波。","回望高城落晓河，长亭窗户压微波。"
"远别的游子像那水仙就要乘赤鲤飞升，芙蓉如面的美人一夜来流下的红泪谁知几多？","水仙欲上鲤鱼去，一夜芙蓉红泪多。"
"这个小村子傍晚的时候风雨潇潇，遇到的绿林好汉竟然也知道我的名字。","暮雨潇潇江上村，绿林豪客夜知闻。"
"当年根本就不用隐遁荒野，如今的世上多半都是你们这样的绿林好汉啊。","他时不用逃名姓，世上如今半是君。"
"杜陵老头居住在杜陵，每年种了贫瘠的田地一顷多。","杜陵叟，杜陵居，岁种薄田一顷余。"
"三月份没有雨刮着旱风，麦苗不开花不多枯黄死。","三月无雨旱风起，麦苗不秀多黄死。"
"九月份降霜秋天寒冷早，禾穗没熟都已经干枯。","九月降霜秋早寒，禾穗未熟皆青乾。"
"官吏明明知道但不报告真相，急迫收租、凶暴征税以求通过考核得奖赏。","长吏明知不申破，急敛暴征求考课。"
"典当桑园、出卖田地来缴纳官府规定的租税，明年的衣食将怎么办？","典桑卖地纳官租，明年衣食将何如？"
"不知什么人报告了皇帝，皇帝心中怜悯、了解人们的困苦。","不知何人奏皇帝，帝心恻隐知人弊。"
"白麻纸上书写着施恩布德的诏令，京城附近全部免除今年的租税。","白麻纸上书德音，京畿尽放今年税。"
"昨天里长才到门口来，手里拿着公文张贴在乡村中。","昨日里胥方到门，手持敕牒榜乡村。"
"十家缴纳的租税九家已送完，白白地受了我们君王免除租税的恩惠。","十家租税九家毕，虚受吾君蠲免恩。"
"秦王骑着猛虎般的骏马，巡游八方，武士们的宝剑照射得天空一片碧光。","秦王骑虎游八极，剑光照空天自碧。"
"命令羲和敲着太阳开道，发出玻璃声响，劫火的余灰已经散尽，国家太平呈祥。","羲和敲日玻璃声，劫灰飞尽古今平。"
"大壶的龙头倾泻着美酒，请来了酒星，弦架镶金的琵琶夜间弹得枨枨响。","龙头泻酒邀酒星，金槽琵琶夜枨枨。"
"像落在洞庭湖上的雨点，那是乐人吹笙，秦王酒兴正浓，喝令月亮退行。","洞庭雨脚来吹笙，酒酣喝月使倒行。"
"灯火辉煌的楼上，歌女们的声音娇弱乏困，绡纱红衣轻轻飘动，散发出淡淡的清芬。","花楼玉凤声娇狞，海绡红文香浅清，"
"仙人形的烛树光芒四射，轻烟濛濛，嫔妃们心满意足，一双双醉眼清泪盈盈。","仙人烛树蜡烟轻，清琴醉眼泪泓泓。"
"酒旗相望着在大堤的上头，堤下船连船，堤上楼挨楼。","酒旗相望大堤头，堤下连樯堤上楼。"
"天色将晚，行人急忙争渡，桨声幽轧轧，船儿满中流。","日暮行人争渡急，桨声幽轧满中流。"
"江南江北同望波浪江烟，入夜行人还对歌在江边。","江南江北望烟波，入夜行人相应歌。"
"《桃叶歌》表达了爱情，《竹枝词》诉说着哀愁，水流和月光无穷无尽哟，恰似歌声中的情感绵绵。","桃叶传情竹枝怨，水流无限月明多。"
"长堤弯弯曲曲，堤内水徘徊，酒舍旗亭一家挨一家地排开。","长堤缭绕水徘徊，酒舍旗亭次第开。"
"傍晚时挑出杏帘儿招徕顾客，高高的大船落帆靠岸停下来。","日晚出帘招估客，轲峨大艑落帆来。"
"回头看巴山的道路隐没在白云里边，我寒食离开家乡麦熟才回来。","回看巴路在云间，寒食离家麦熟还。"
"傍晚时分，前面出现了几座青得像是染过一样的山峰。听人说这就是汝州的山。","日暮数峰青似染，商人说是汝州山。"
"梦中我回到了故乡，看到黄叶满院，青苔满地，一片荒凉景象。拂晓梦醒以后，我听到城头上军号悲鸣。","故园黄叶满青苔，梦破城头晓角哀。"
"此夜梦中我未能和想念的人见面，心情惆怅，只好起来在残月下伴影徘徊。","此夜断肠人不见，起行残月影徘徊。"
"长安城头，伫立着一只白头乌鸦，夜暮了，还飞进延秋门上叫哇哇。","长安城头头白乌，夜飞延秋门上呼。"
"这怪物，又向大官邸宅啄个不停，吓得达官们，为避胡人逃离了家。","又向人家啄大屋，屋底达官走避胡。"
"玄宗出奔，折断金鞭又累死九马，皇亲国戚，来不及和他一同驱驾。","金鞭断折九马死，骨肉不得同驰驱。"
"有个少年，腰间佩带玉块和珊瑚，可怜呵，他在路旁哭得嗓子嘶哑。","腰下宝玦青珊瑚，可怜王孙泣路隅。"
"千问万问，总不肯说出自己姓名，只说生活困苦，求人收他做奴伢！","问之不肯道姓名，但道困苦乞为奴。"
"已经有一百多天，逃窜荆棘丛下，身上无完肤，遍体是裂痕和伤疤。","已经百日窜荆棘，身上无有完肌肤。"
"凡是高帝子孙，大都是鼻梁高直，龙种与布衣相比，自然来得高雅。","高帝子孙尽隆准，龙种自与常人殊。"
"豺狼在城称帝，龙种却流落荒野，王孙呵，你一定要珍重自己身架。","豺狼在邑龙在野，王孙善保千金躯。"
"在十字路口，不敢与你长时交谈，只能站立片刻，交待你重要的话。","不敢长语临交衢，且为王孙立斯须。"
"昨天夜里，东风吹来阵阵血腥味，长安东边，来了很多骆驼和车马。","昨夜东风吹血腥，东来橐驼满旧都。"
"北方军队，一贯是交战的好身手，往日勇猛，如今何以就流水落花。","朔方健儿好身手，昔何勇锐今何愚。"
"私下听说，皇上已把皇位传太子，南单于派使拜服，圣德安定天下。","窃闻天子已传位，圣德北服南单于。"
"他们个个割面，请求雪耻上前线，你要守口如瓶，以防暗探的缉拿。","花门剺面请雪耻，慎勿出口他人狙。"
"多可怜呵王孙，你万万不要疏忽，五陵之气葱郁，大唐中兴有望呀！","哀哉王孙慎勿疏，五陵佳气无时无。"
"放眼遥望巴陵地区洞庭湖一带的秋景，成天看到的就是这孤独的君山漂浮在水中。","巴陵一望洞庭秋，日见孤峰水上浮。"
"传说这君山上曾居住着神仙可惜未能得见，我的心潮随着那荡漾的湖水绵远悠长。","闻道神仙不可接，心随湖水共悠悠。"
"江上的燕子都明白我的茅屋过于低小，因此常常飞到这里筑巢。","熟知茅斋绝低小，江上燕子故来频。"
"燕子衔来筑巢的泥弄脏了我的琴和书，它们还不停地追逐飞虫碰着了人。","衔泥点污琴书内，更接飞虫打着人。"
"乱云就像猛兽奔涌出山前，细雨和风洒遍了渭河河川。","乱云如兽出山前，细雨和风满渭川。"
"终日阴雨濛濛什么也不见，几行归去的雁就好像字联。","尽日空濛无所见，雁行斜去字联联。"
"卖花翁摘下一丛新鲜的花朵，担入了许府和史府。","和烟和露一丛花，担入宫城许史家。"
"东风吹来，不见百花绽放，寂寥空空，心中失落无比，只知百花闭锁进豪门深府。","惆怅东风无处说，不教闲地著春华。"
"从早到晚整天采桑多苦辛，百花盛开季节养蚕忙煞人。","晓夕采桑多苦辛，好花时节不闲身。"
"若教村姑了解赏花之类事，便会冻死富家太太小妞们。","若教解爱繁华事，冻杀黄金屋里人。"
"漂泊江湖偶尔相逢客恨实在多，黄叶纷纷落下洞庭湖水波连波。","江海相逢客恨多，秋风叶下洞庭波。"
"深夜畅饮即将作别淮阴的街市，月照高楼我们引吭高唱离别歌。","酒酣夜别淮阴市，月照高楼一曲歌。"
"君王的恩宠就跟流水一样不停地东流，使得宫女得宠的时候担心恩宠转移，失宠的时候又忧愁。","君恩如水向东流，得宠忧移失宠愁。"
"莫要在君王的宴席上得意地演奏《梅花落》了，凉风不远，你不久也会像花儿那样被风吹落的。","莫向尊前奏花落，凉风只在殿西头。"
"柴门多日紧闭不开，门前石阶铺满了白雪皑皑。","三日柴门拥不开，阶平庭满白皑皑。"
"如今有人把琼玉般的积雪踏碎，是友人从京城给我寄了诗来。","今朝蹋作琼瑶迹，为有诗从凤沼来。"
"看着眼前丰收的景象，男人们的话语里充满了喜悦，女人们的脸上也洋溢着笑容，家家户户再也没有怨言，说的话也和往常不一样了。","男声欣欣女颜悦，人家不怨言语别。"
"虽然五月天气炎热，此时的麦风却给人以清凉的感觉。在村中的屋檐下，妇女们正忙着用缲车缫丝，缲车上发出一阵阵倾细的声音。","五月虽热麦风清，檐头索索缲车鸣。"
"家蚕丰收，野蚕做的茧再也没有人来收取，于是这些茧在树上就变成了秋蛾，在树叶间扑扑地飞舞着。","野蚕作茧人不取，叶间扑扑秋蛾生。"
"麦子收割以后一筐一筐地堆放在麦场上，绢布织成后一匹一匹地缠在轴上，农民们可以确认今年的收成已足够缴纳官府的赋税了。","麦收上场绢在轴，的知输得官家足。"
"不指望还有入口的粮食，也不指望还有绢布剩下来做件衣服穿在身上，只是暂且可以免除去前往城中卖掉自己的小黄牛了。","不望入口复上身，且免向城卖黄犊。"
"农民家庭的衣食实在谈不上什么好与坏，只要家里人不被捉进县衙门，便是一件很值得高兴的事情了。","回家衣食无厚薄，不见县门身即乐。"
"尖峭的山城，崎岖的小路，以及插在城头的旌旗都暗自发愁。就在这样的地方，孤孤单单、若隐若现地耸立着一座飞腾的高楼。","城尖径昃旌旆愁，独立缥缈之飞楼。"
"云霾隔断连绵的山峡，群山如同龙虎在静卧；阳光映照着清澈的江水，波光好像鼋鼍在浮游。","峡坼云霾龙虎卧，江清日抱鼋鼍游。"
"扶桑西端的树枝遥对山峡的断石，弱水东来的影子紧接长江的流水。","扶桑西枝对断石，弱水东影随长流。"
"拄着藜杖感叹世事的人究竟是谁？血泪飘洒空中，就在我满头白发回顾的时候。","杖藜叹世者谁子，泣血迸空回白头。"
"我年轻时在楚汉一带落魄失意，到处受到冷遇，流落风尘而郁郁寡欢。","少年落魄楚汉间，风尘萧瑟多苦颜。"
"自言有管葛之才而有谁推许？只好长吁短叹，闭门谢客，在家赋闲。","自言管葛竟谁许，长吁莫错还闭关。"
"一旦天子垂顾，加以佛拭之恩，我则尽心竭力以尽忠心。","一朝君王垂拂拭，剖心输丹雪胸臆。"
"忽蒙天子白日之光垂照，我如同胁王两翅，直飞青云之上。","忽蒙白日回景光，直上青云生羽翼。"
"有幸陪天子銮驾东入鸿都之门，身骑官中之龙马，好不威风。","幸陪鸾辇出鸿都，身骑飞龙天马驹。"
"这时王公大人无不借我以颜色，金章紫绶之高官也来奔走相趋。","王公大人借颜色，金璋紫绶来相趋。"
"当时与我结交的人是何等之多，但只有您才与我真正地志同道合。","当时结交何纷纷，片言道合惟有君。"
"待我尽节报效明主之后，我要与君一起隐居南山，同卧白云。","待吾尽节报明主，然后相携卧白云。"
