"trans","origin"
"雁声凄厉远远地飞过潇湘去，十二楼中的明月空自放光明。","雁声远过潇湘去，十二楼中月自明。"
"金井边的梧桐秋叶渐黄，珠帘不卷可知夜里飞霜。","金井梧桐秋叶黄，珠帘不卷夜来霜。"
"熏笼玉枕有如容颜憔悴，静卧愁听南宫漏声悠长。","熏笼玉枕无颜色，卧听南宫清漏长。"
"秋天高殿内捣衣声响彻夜阑，夜里霜重还记起君王御衣寒。","高殿秋砧响夜阑，霜深犹忆御衣寒。"
"更深人静银灯下裁衣才停歇，目光还转向宫城明主那边看。","银灯青琐裁缝歇，还向金城明主看。"
"天亮就拿起扫帚打扫金殿尘埃，百无聊赖时手执团扇且共徘徊。","奉帚平明金殿开，暂将团扇共徘徊。"
"美丽的容颜还不如乌鸦的姿色，它还能带着昭阳殿的日影飞来。","玉颜不及寒鸦色，犹带昭阳日影来。"
"果真成为薄命人长久陷入沉思，梦中又见到君王醒后心里生疑。","真成薄命久寻思，梦见君王觉后疑。"
"灯火照耀着西宫知道是在夜饮，眼前分明浮现复道蒙恩受宠时。","火照西宫知夜饮，分明复道奉恩时。"
"长信宫中惟有秋月尚明，昭阳殿下响起捣衣声声。","长信宫中秋月明，昭阳殿下捣衣声。"
"白露堂中满是杂草印迹，那边红罗帐里绵绵深情。","白露堂中细草迹，红罗帐里不胜情。"
"花木兰女扮男装去参军打仗,一去就是十二年。她在梦乡里，也会和女伴们一起对镜梳妆。","弯弓征战作男儿，梦里曾经与画眉。"
"只是为了替爷从军、保家卫国，多次想回家时竭力克制着自己与边关将士大碗喝酒。想想木兰为了安靖边烽，万里从戎，她也将会和王昭君和亲，死留青冢一样，永远博得后世敬爱! ","几度思归还把酒，拂云堆上祝明妃。"
"不知不觉就立秋了，夜也渐渐长了。清凉的风缓缓地吹着，又感到凉爽了。","不觉初秋夜渐长，清风习习重凄凉。"
"酷热的夏天热气终于消退，房子里也安静了。台阶下的草丛也有了点点露水珠。","炎炎暑退茅斋静，阶下丛莎有露光。"
"一个巴地小女孩骑着牛儿，唱着竹枝词，沿着处处盛开着荷花、铺展菱叶的江岸，慢悠悠地回家。","巴女骑牛唱竹枝，藕丝菱叶傍江时。"
"不怕天晚了找不到家门，我知道我家门前有一棵芭蕉高高地挺出了木槿篱笆。","不愁日暮还家错，记得芭蕉出槿篱。"
"关中兵荒马乱百姓流离失所，躲避战乱漂泊流浪来到西南。","支离东北风尘际，漂泊西南天地间。"
"长久地停留三峡楼台熬日月，与五溪民族都住在一片云山。","三峡楼台淹日月，五溪衣服共云山。"
"羯胡人狡诈事主终究不可靠，伤时感世的诗人至今未回还。","羯胡事主终无赖，词客哀时且未还。"
"梁代庾信的一生处境最凄凉，到晚年作的诗赋轰动了江关。","庾信平生最萧瑟，暮年诗赋动江关。"
"我离开洛城之后便四处漂泊，远离它已有四千里之遥，安史之乱叛军长驱直入中原也已经有五六年了。","洛城一别四千里，胡骑长驱五六年。"
"草木由青变衰，我来到剑阁之外，为兵戈阻断，在江边渐渐老去。","草木变衰行剑外，兵戈阻绝老江边。"
"我思念家乡，忆念胞弟，清冷的月夜，思不能寐，忽步忽立。","思家步月清宵立，忆弟看云白日眠。"
"冷落的白昼，卧看行云，倦极而眠。令人高兴的是听说司徒已攻克河阳，正乘胜追击敌人，急于要拿下幽燕。","闻道河阳近乘胜，司徒急为破幽燕。"
"玄宗返回长安杨贵妃早已死，旧时恩爱难忘国家开始振兴。","玄宗回马杨妃死，云雨难忘日月新。"
"处死杨妃也是玄宗英明决策，不然就会步陈后主亡国后尘。","终是圣明天子事，景阳宫井又何人。"
"南陵的江水，满满地、慢悠悠地流荡，西风紧吹，轻云掠过，秋天即将来到身旁。","南陵水面漫悠悠，风紧云轻欲变秋。"
"正当客居他乡，心情孤寂凄清的时候，忽见哪家的女子独倚在临江的楼窗？","正是客心孤迥处，谁家红袖凭江楼？"
"晚上在江楼上向东望去，海天相连，一片茫茫；山川形势，又阔又长。","海天东望夕茫茫，山势川形阔复长。"
"城的四周亮起了万家灯火，一道银河映入水的中央。","灯火万家城四畔，星河一道水中央。"
"晴天时，风吹古树，瑟瑟作响，好像是在下雨一般；夏夜里，月光撒满了平地，就跟秋霜一样。","风吹古木晴天雨，月照平沙夏夜霜。"
"能不能到江楼来消消暑气？比起您的茅屋，的确要更加清凉。","能就江楼消暑否？比君茅舍较清凉。"
"春天青草丛生，绿柳抽芽，桃花挂在枝头丛丛点缀，李子花的香味飘得远远都是。","草色青青柳色黄，桃花历乱李花香。"
"（但是在这样生机盎然的春天），春风依然不能为我吹散烦恼忧愁，我的愁思怨恨偏偏在这春天一直滋长。","东风不为吹愁去，春日偏能惹恨长。"
"美人在吆喝着卖酒，扭动着腰肢的佳人们（在旁边作陪）；金花茶配着米酒可以解酴醿酒。","红粉当垆弱柳垂，金花腊酒解酴醿。"
"在这日夜不间断的歌舞声中，最能留住来往的客人，能把长安所有的轻薄人都醉死在这温柔乡里。","笙歌日暮能留客，醉杀长安轻薄儿。"
"三月三日阳春时节天气清新，长安曲江河畔聚集好多美人。","三月三日天气新，长安水边多丽人。"
"姿态凝重神情高远文静自然，肌肤丰润胖瘦适中身材匀称。","态浓意远淑且真，肌理细腻骨肉匀。"
"绫花绫罗衣裳映衬暮春风光，金丝绣的孔雀银丝刺的麒麟。","绣罗衣裳照暮春，蹙金孔雀银麒麟。"
"其中有几位都是后妃的亲戚，里面有虢国和秦国二位夫人。","就中云幕椒房亲，赐名大国虢与秦。"
"翡翠蒸锅端出香喷的紫驼峰，水晶圆盘送来肥美的白鱼鲜。","紫驼之峰出翠釜，水精之盘行素鳞。"
"她们捏着犀角筷子久久不动，厨师们快刀细切空忙了一场。","犀箸厌饫久未下，鸾刀缕切空纷纶。"
"宦官骑马飞驰不敢扬起灰尘，御厨络绎不绝送来海味山珍。","黄门飞鞚不动尘，御厨络绎送八珍。"
"笙箫鼓乐缠绵宛转感动鬼神，宾客随从满座都是达官贵人。","箫鼓哀吟感鬼神，宾从杂遝实要津。"
"有一个骑马官人是何等骄横，车前下马从绣毯上走进帐门。","后来鞍马何逡巡，当轩下马入锦茵。"
"白雪似的杨花飘落覆盖浮萍，青鸟飞去衔起地上的红丝帕。","杨花雪落覆白苹，青鸟飞去衔红巾。"
"杨家气焰很高权势无与伦比，切勿近前以免丞相发怒斥人！","炙手可热势绝伦，慎莫近前丞相嗔！"
"登上燕台眺望不禁感到震惊，笳鼓喧闹之地原是汉将兵营。","燕台一望客心惊，笳鼓喧喧汉将营。"
"万里积雪笼罩着冷冽的寒光，边塞的曙光映照着旌旗飘动。","万里寒光生积雪，三边曙色动危旌。"
"战场烽火连天遮掩边塞明月，南渤海北云山拱卫着蓟门城。","沙场烽火侵胡月，海畔云山拥蓟城。"
"少年时虽不像班超投笔从戎，论功名我想学终军自愿请缨。","少小虽非投笔吏，论功还欲请长缨。"
"泰山不能损坏毫发，颜渊无意羡慕老聃和彭祖。","泰山不要欺毫末，颜子无心羡老彭。"
"松树活了一千年终究要死，槿木仅开花一天也自觉荣耀。","松树千年终是朽，槿花一日自为荣。"
"何必眷恋尘世常怕死，也不要嫌弃而厌恶生活。","何须恋世常忧死，亦莫嫌身漫厌生。"
"生与死都是一种幻觉，梦幻人的悲哀欢乐又维系人间情呢。","生去死来都是幻，幻人哀乐系何情。"
"隋炀帝为南游江都不顾安全，九重宫中有谁理会劝谏书函。","乘兴南游不戒严，九重谁省谏书函。"
"春游中全国裁制的绫罗锦缎，一半作御马障泥一半作船帆。","春风举国裁宫锦，半作障泥半作帆。"
"半夜里就喊起孩子们，趁著天刚破晓，赶紧到田里去犁土，瘦弱的老牛有气无力，正拉著犁在田里艰难地走著，越走越慢，累得几乎拖不动犁具了。","半夜呼儿趁晓耕，羸牛无力渐艰行。"
"一般人不知道种田人的辛苦，竟说田里的稻禾是自然而然就长成的。","时人不识农家苦，将谓田中谷自生。"
"人的一生总是非常多的波折，花明柳暗之事让人兴起无限愁绪，就像尽力登上很高的城楼才发现更高的楼还在前方。","花明柳暗绕天愁，上尽重城更上楼。"
"仰望天空，万里寂寥，只有一只孤雁在夕阳余光的映照下孑然飞去，但到了这个时候，忽然才顿悟自己的身世原来也和这秋日的孤雁一样孑然无助。","欲问孤鸿向何处，不知身世自悠悠。"
"湘山的倒影向天连，碧水山色啊掩映天。","烟波不动影沉沉，碧色全无翠色深。"
"或许湘君前来梳洗，君山望镜自照面颜。","疑是水仙梳洗处，一螺青黛镜中心。"
"黄昏时分，猿声凄切，江边送客早已四散。江水滚滚，一片苍茫，独自更觉伤心悲凉。","猿啼客散暮江头，人自伤心水自流。"
"同被贬逐漂泊，只是君行更远。青山万里，我真是挂念你的一叶扁舟。","同作逐臣君更远，青山万里一孤舟。"
"飘落在小路上的杨花碎片，就像铺开的白毡子，点缀在溪上的嫩荷，像青铜钱似的一个叠着一个。","糁径杨花铺白毡，点溪荷叶叠青钱。"
"竹林里笋根旁才破土而出的嫩笋，还没有人注重它们，刚刚孵出的小水鸭子，在沙滩上依偎着母鸭甜甜地睡着。","笋根雉子无人见，沙上凫雏傍母眠。"
"五原的春天总是姗姗来迟，二月之间，垂杨尚未发芽。","五原春色旧来迟，二月垂杨未挂丝。"
"黄河岸边。如今开始冰雪消融。长安城里，却正当落花时节。","即今河畔冰开日，正是长安花落时。"
"突然听到梅福前来造访（寒舍），（我）笑着穿上荷衣走出草堂。","忽闻梅福来相访，笑着荷衣出草堂。"
"村里的小孩很少见过官员的车马（那浩荡的气势），都慌忙跑到芦苇荡的深处躲藏。","儿童不惯见车马，走入芦花深处藏。"
"久旱无雨，桑树枝都长不出叶子来，地面异常干燥，尘土飞扬，土地好像要生烟燃烧；龙王庙前，人们敲锣打鼓，祈求龙王普降甘霖。","桑条无叶土生烟，箫管迎龙水庙前。"
"而富贵人家却处处观赏歌舞，还怕春天的阴雨使管弦乐器受潮而发不出清脆悦耳的声音。","朱门几处看歌舞，犹恐春阴咽管弦。"
"五月，松下的茅草亭里却凉爽宜人，白沙覆盖的汀洲和远处的繁茂树林融入了暮色，呈现出一片苍苍茫茫。","松下茅亭五月凉，汀沙云树晚苍苍。"
"路上的行人兴起了无限的思乡之情，此处的青山绿水也仿佛是自己的故乡了。","行人无限秋风思，隔水青山似故乡。"
"在木兰为桨沙棠为舟的船上，箫管之乐在船的两头吹奏着。","木兰之枻沙棠舟，玉箫金管坐两头。"
"船中载着千斛美酒和美艳的歌妓，任凭它在江中随波逐流。","美酒樽中置千斛，载妓随波任去留。"
"黄鹤楼上的仙人还有待于乘黄鹤而仙去，而我这个海客却毫无机心地与白鸥狎游。","仙人有待乘黄鹤，海客无心随白鸥。"
"屈原的词赋至今仍与日月并悬，而楚王建台榭的山丘之上如今已空无一物了。","屈平辞赋悬日月，楚王台榭空山丘。"
"我兴酣之时，落笔可摇动五岳，诗成之后，啸傲之声，直凌越沧海。","兴酣落笔摇五岳，诗成笑傲凌沧洲。"
"功名富贵若能常在，汉水恐怕就要西北倒流了。","功名富贵若长在，汉水亦应西北流。"
"帝王之都，到处月光如水，花灯如山， 装饰华丽的香艳的马车堵塞了宽敞大道。","月色灯山满帝都，香车宝盖隘通衢。"
"身处闲暇却无缘目睹中兴之年元宵盛况， 只得带着羞惭随着老乡去观看迎接紫姑神的庙会。","身闲不睹中兴盛，羞逐乡人赛紫姑。"
"天上的浮云不能与此山平齐，山峦云雾苍苍远望反更迷离。","浮云不共此山齐，山霭苍苍望转迷。"
"拂晓弯月暂时飞隐到高树里，秋夜的银河远隔在数峰以西。","晓月暂飞高树里，秋河隔在数峰西。"
"岭南道中溪流纵横交错，地势迂回曲折，置身其间，茫然不知身在何处。沿途随处可见高大的乔木，绿树丛阴下，溪流显得格外幽深。","岭水争分路转迷，桄榔椰叶暗蛮溪。"
"我在旅途中提心吊胆，担心遇上毒雾，碰着蛇草；为了躲避沙虫，看见燕子衔泥也会急忙让开。","愁冲毒雾逢蛇草，畏落沙虫避燕泥。"
"这里的风俗很特别，五月即收稻米，三更公鸡就打鸣，每当涨潮，它还会按时啼叫，这时津吏就会通知乡民潮汛要来了。","五月畲田收火米，三更津吏报潮鸡。"
"这一切让人一时难以适应，看着那鲜艳欲滴的红槿花，听着那树上越鸟的鸣叫，想到想起家乡，这谪居岁月何时是个尽头，想起这些真是肝肠寸断。","不堪肠断思乡处，红槿花中越鸟啼。"
"去年看菊花我和您告别，今年听到蝉叫我又返回。","昔看黄菊与君别，今听玄蝉我却回。"
"五更的风声飕飗枕上觉，一年的颜状变化镜中来。","五夜飕飗枕前觉，一年颜状镜中来。"
"战马思念边草拳毛抖动，大雕顾盼青云睡眼睁开。","马思边草拳毛动，雕眄青云睡眼开。"
"秋高气爽正好极目远望，我为您抱着病登上高台。","天地肃清堪四望，为君扶病上高台。"
"六月的火焰山更是灼热，赤亭道口怕要行人断绝。","火山六月应更热，赤亭道口行人绝。"
"知道您经常度越祁连城，哪里会害怕见到轮台月。","知君惯度祁连城，岂能愁见轮台月。"
"请您下马暂进入酒家垆，送您到万里之外西击胡。","脱鞍暂入酒家垆，送君万里西击胡。"
"功名富贵只向马上求取，您真是一位英雄大丈夫。","功名祗向马上取，真是英雄一丈夫。"
"日光洒在纱窗上，微风拂过，窗子轻轻摇动。空旷的屋子里，独自以罗帕拭手，窗外春将近，花事了。","日射纱窗风撼扉，香罗拭手春事违。"
"步入院中，回廊四合，寂寞涌现。孤单一人无伴，只见蔷薇花开灿烂，只闻鹦鹉学舌之声。而蔷薇谢后，春天也就过去了，正如青春流逝，无可奈何；只闻鹦鹉之声，却不见当年之人。","回廊四合掩寂寞，碧鹦鹉对红蔷薇。"
"君主追求淫逸，将国计民生的大事看得很轻。结果，兵变作乱。","君王游乐万机轻，一曲霓裳四海兵。"
"帝后升天，惟有千年长生树仍直直地长在那里。","玉辇升天人已尽，故宫犹有树长生。"
"山石峥嵘险峭，山路狭窄像羊肠，蝙蝠穿飞的黄昏，来到这座庙堂。","山石荦确行径微，黄昏到寺蝙蝠飞。"
"登上庙堂坐台阶，刚下透雨一场，经雨芭蕉枝粗叶大，山栀更肥壮。","升堂坐阶新雨足，芭蕉叶大栀子肥。"
"僧人告诉我说，古壁佛画真堂皇，用火把照看，迷迷糊糊看不清爽。","僧言古壁佛画好，以火来照所见稀。"
"为我铺好床席，又准备米饭菜汤，饭菜虽粗糙，却够填饱我的饥肠。","铺床拂席置羹饭，疏粝亦足饱我饥。"
"夜深清静好睡觉，百虫停止吵嚷，明月爬上了山头，清辉泻入门窗。","夜深静卧百虫绝，清月出岭光入扉。"
"天明我独自离去，无法辨清路向，出入雾霭之中，我上下摸索踉跄。","天明独去无道路，出入高下穷烟霏。"
"山花鲜红涧水碧绿，光泽又艳繁，时见松栎粗大十围，郁郁又苍苍。","山红涧碧纷烂漫，时见松枥皆十围。"
"遇到涧流当道，光着脚板踏石淌，水声激激风飘飘，掀起我的衣裳。","当流赤足踏涧石，水声激激风吹衣。"
"人生在世能如此，也应自得其乐，何必受到约束，宛若被套上马缰？","人生如此自可乐，岂必局束为人鞿？"
"唉呀，我那几个情投意合的伙伴，怎么能到年老，还不再返回故乡？","嗟哉吾党二三子，安得至老不更归。"
"去年在桑干源打仗，今年转战葱河河畔。","去年战，桑干源，今年战，葱河道。"
"曾经在条支海中洗过兵器上的污秽，也在天山草原上牧放过疲惫的战马。","洗兵条支海上波，放马天山雪中草。"
"秦朝的筑城备胡之处，汉朝依然有烽火在燃烧。","秦家筑城避胡处，汉家还有烽火燃。"
"还在溪上航行，就已听到寺庙的悠悠钟声。停船拾阶而上，山路蜿蜒穿越着秘密松林。","溪上遥闻精舍钟，泊舟微径度深松。"
"雨后初晴，山色青翠，白云悠悠飘荡。眺望西南，四五青峰，更加郁郁葱葱，犹若刚刚画成。","青山霁后云犹在，画出东南四五峰。"
"五老峰坐落于庐山的东南，耸立如青天削出，就像一朵盛开的金色莲花。","庐山东南五老峰，青天削出金芙蓉。"
"登上峰顶可以揽取九江的秀丽景色，我将在这里巢居于云松。","九江秀色可揽结，吾将此地巢云松。"
"今天是三月三十日，是三月的最后一天，春天美丽的风光就有离开我这位苦吟诗人了。","三月正当三十日，风光别我苦吟身。"
"我和你今夜不用睡觉了，在晨钟响动之前，总算还是春天吧。","共君今夜不须睡，未到晓钟犹是春。"
"十岁就能够即席作诗，酒宴上的蜡烛烧残了大半，烛芯的灰烬也冷却了。送别的筵宴已近尾声，在座的人触动离情。","十岁裁诗走马成，冷灰残烛动离情。"
"遥远的丹山道上，美丽的桐花覆盖遍野，丹山路上不时传来雏凤清脆圆润的鸣声，应和着老凤苍亮的呼叫，显得更为悦耳动听。","桐花万里丹山路，雏凤清于老凤声。"
"鹤借助风力飞入青天自由翱翔，鹅却命运不济被迫和鸭子为伍。","君因风送入青云，我被人驱向鸭群。"
"我鹅长有雪白的脖颈、洁白的羽毛和红红的脚掌，哪一点比不上鹤？","雪颈霜毛红网掌，请看何处不如君？"
"曾经的歌台，曾经的舞榭，曾经的园林，曾经的宫殿，如今都已经荒废，只有杨柳叶儿青青，还有那湖中的采菱女在清唱着青春永恒的歌谣。","旧苑荒台杨柳新，菱歌清唱不胜春。"
"谁还记得吴王夫差的事儿呢？只有那城西河中的明月，曾经照耀过吴王宫殿，照耀过在宫中灯红酒绿的人。","只今惟有西江月，曾照吴王宫里人。"
"水国的天气带着初春的寒意，忽晴忽阴，忽好忽坏；在这春风乍起的日子，我所乘的船停泊在苏州城外。","春风倚棹阖闾城，水国春寒阴复晴。"
"蒙蒙细雨润湿了衣服，自己却没有注意到；枝上的花朵飘落到地上，听不到声响。","细雨湿衣看不见，闲花落地听无声。"
"薄暮夕阳下，江上孤帆远去；太湖之南碧草如茵，绵延万里。","日斜江上孤帆影，草绿湖南万里情。"
"或许有朋友会问到我的境遇，请转告他们，我这个一介书生，命途多舛，已被“青袍”所误。","东道若逢相识问，青袍今已误儒生。"
"今年外出游玩的时候，自己独自来到了长安，没有朋友同游心中带着春愁来看春天，没有了春天的感觉。","今年游寓独游秦，愁思看春不当春。"
"上林苑中的花白白地开放了，细柳营前的柳叶也徒有新芽。","上林苑里花徒发，细柳营前叶漫新。"
"朋友们这时在南桥应该玩得正是尽兴，将军府里朋友们欢聚都不愿散去。","公子南桥应尽兴，将军西第几留宾。"
"我在这里向着遥远的洛阳，对着春天的景物说，等我和朋友再相聚的时候明年的春天一定要加倍地还给我一个更美的春色啊！","寄语洛城风日道，明年春色倍还人。"
"圣女祠的白石门边长满碧绿的苔藓，从上清仙境谪落此地迟迟未得回还。","白石岩扉碧藓滋，上清沦谪得归迟。"
"春天里蒙蒙细雨常洒向大殿的青瓦，整日里神风微弱吹不动祠中的旗幡。","一春梦雨常飘瓦，尽日灵风不满旗。"
"萼绿华自由自在说来就来居无定所，杜兰香青童接驾说走就走立时归返。","萼绿华来无定所，杜兰香去未移时。"
"玉郎与圣女相会于此并给通报仙籍，圣女想一起登天阶服紫芝位列众仙。","玉郎会此通仙籍，忆向天阶问紫芝。"
"扬州的少女们无忧无虑，笑脸迎人，娇美的脸上怎能藏住眼泪，她们可爱的眉梢上所挂的一点忧愁也容易被人察觉。","萧娘脸薄难胜泪，桃叶眉尖易得愁。"
"天下明月的光华有三分吧，可爱的扬州啊，你竟然占去了两分。","天下三分明月夜，二分无赖是扬州。"
"春天青草丛生，绿柳抽芽，桃花挂在枝头丛丛点缀，李子花的香味飘得远远都是。","草色青青柳色黄，桃花历乱李花香。"
"（但是在这样生机盎然的春天），春风依然不能为我吹散烦恼忧愁，我的愁思怨恨偏偏在这春天一直滋长。","东风不为吹愁去，春日偏能惹恨长。"
"天上的浮云不能与此山平齐，山峦云雾苍苍远望反更迷离。","浮云不共此山齐，山霭苍苍望转迷。"
"拂晓弯月暂时飞隐到高树里，秋夜的银河远隔在数峰以西。","晓月暂飞高树里，秋河隔在数峰西。"
"环曲的池塘水面，雨水像在抽丝一般密织，野禽因为雨势太大无法起飞，鱼儿却惊得在水面飞跃起来。","回塘雨脚如缫丝，野禽不起沈鱼飞。"
"耕种的人和垂钓者都来不及取蓑衣和斗笠，秋季的田地都多么期待这么一场酣畅淋漓的大雨啊。","耕蓑钓笠取未暇，秋田有望从淋漓。"
"我独自坐在山间的岩石上，看见前面浓密的乌云含着雨水喷洒在前方的山峦上，而此却依然阳光灿烂。","坐看黑云衔猛雨，喷洒前山此独晴。"
"我正悠然欣赏大自然这一奇观时，忽然大吃一惊——滚滚的乌云挟带着狂风骤雨，已泻到了我的头上！不过我却意外地发现：前山青翠的山峰上，还是映照着一抹夕阳的余晖！","忽惊云雨在头上，却是山前晚照明。"
"一双幽暗的松树在尘世出现，数粒稚嫩而翠绿的小松初生的枝叶挂在二尺高的松树上。","一双幽色出凡尘，数粒秋烟二尺鳞。"
"从此静静的书窗外可以听这细微的松声，如琴声一般常伴着读书人。","从此静窗闻细韵，琴声长伴读书人。"
"贾谊被贬在此地居住三年，可悲遭遇千万代令人伤情。","三年谪宦此栖迟，万古惟留楚客悲。"
"我在秋草中寻觅人迹不在，寒林里空见夕阳缓缓斜倾。","秋草独寻人去后，寒林空见日斜时。"
"汉文帝重才恩德尚且淡薄，湘江水无意凭吊有谁知情？","汉文有道恩犹薄，湘水无情吊岂知。"
"寂寞冷落深山里落叶纷纷，可怜你不知因何天涯飘零？","寂寂江山摇落处，怜君何事到天涯。"
"祖居少陵的野老（杜甫自称）无声地痛哭，春天偷偷地来到了曲江边。","少陵野老吞声哭，春日潜行曲江曲。"
"江岸的宫殿千门闭锁，细细的柳丝和新生的水蒲为谁而绿？","江头宫殿锁千门，细柳新蒲为谁绿？"
"回忆当初皇帝的彩旗仪仗下了南苑，苑里的万物都生出光辉。","忆昔霓旌下南苑，苑中万物生颜色。"
"昭阳殿里的第一美人也同车出游，随侍在皇帝身旁。","昭阳殿里第一人，同辇随君侍君侧。"
"车前的宫中女官带着弓箭，白马套着带嚼子的黄金马勒。","辇前才人带弓箭，白马嚼啮黄金勒。"
"翻身朝天上的云层射去，一笑之间双飞的一对鸟儿便坠落在地。","翻身向天仰射云，一笑正坠双飞翼。"
"杨贵妃明亮的眼睛和洁白的牙齿在哪里呢？鲜血玷污了她的游魂，再也不能归来！","明眸皓齿今何在？血污游魂归不得。"
"清清的渭水向东流去，而玄宗所在的剑阁是那么深远。走的和留下的彼此没有消息。","清渭东流剑阁深，去住彼此无消息。"
"人生有情，泪水沾湿了胸臆，江水的流淌和江花的开放哪里会有尽头呢？","人生有情泪沾臆，江水江花岂终极！"
"黄昏时，胡骑扬起满城的尘土，我想去城南，却望着城北。 ","黄昏胡骑尘满城，欲往城南望城北。"
"冰雪融尽，入侵的胡兵已经悄然返还。月光皎洁，悠扬的笛声回荡在戍楼间。","雪净胡天牧马还，月明羌笛戍楼间。"
"试问饱含离情的《梅花曲》飘向何处？它仿佛像梅花一样随风落满了关山。","借问梅花何处落，风吹一夜满关山。"
"旅舍中春残夜雨刚刚晴，恍然间心里忆起长安城。","旅舍残春宿雨晴，恍然心地忆咸京。"
"树枝中蜂拥蝶舞花将落，水面上风起柳絮飘飘行。","树头蜂抱花须落，池面鱼吹柳絮行。"
